{
  "$schema": "http://json-schema.org/draft-07/schema#",
  "$id": "derivation_v1.schema.json",
  "title": "Derivation — how a set was produced from a parent set",
  "description": "First-class record of ONE derivation operation. Links a parent_set (or parents) to a child set via an operation_type + operation_params + optional filter_profile + analysis_purpose. Decouples the operation identity from the child set: a derivation_id can be reused if two sets are produced the same way, and two derivations with the same parent + operation_type + params + filter_profile + coordinate_system must produce the same hash. Per SETS_AND_ANALYSES.md §'Derivation as a first-class record'. One JSON per derivation under <registry_root>/derivations/<derivation_id>.json.\n\nThe distinction from set_v1.derived_from (the inline set-algebra form) is intentional: set-algebra ops (intersect / union / difference / filter / from_set / from_inline) compose pure logical combinations and have no software / random-seed / parameter dependencies. Operation-style derivations (thin_by_distance, window_extract, random_sample, callability_filter, …) DO depend on a parameter bundle, possibly a random seed, a software version, and an analysis purpose — those go through derivation_id + operation_params_id.",
  "type": "object",
  "required": ["derivation_id", "operation_type", "parent_set_id", "created_at"],
  "additionalProperties": true,
  "properties": {
    "derivation_id": {
      "type": "string",
      "pattern": "^derive_[a-z][a-z0-9_]*$",
      "description": "Stable identifier. Convention: 'derive_<what>_<scope>_v<N>' (e.g. 'derive_beagle_thin500_global_v1', 'derive_lostruct_LG28_v1'). Reusable across child sets that share the same recipe."
    },
    "label": {
      "type": "string",
      "description": "Human-readable display label for the recipe."
    },
    "operation_type": {
      "type": "string",
      "pattern": "^[a-z][a-z0-9_]*$",
      "description": "Canonical name of the operation kind. Examples: 'thin_by_distance', 'window_extract', 'random_sample', 'callability_filter', 'maf_filter', 'sort_then_take_n', 'concordance_intersect'. Open vocabulary — atlases may add their own. NOT for pure set algebra (intersect / union / difference / filter / from_set / from_inline) — those stay inline on set_v1.derived_from."
    },
    "parent_set_id": {
      "type": "string",
      "description": "FK into set_v1.set_id. The set this derivation reads FROM. For multi-parent operations (rare; usually set-algebra handles those inline), use parent_set_ids[] instead."
    },
    "parent_set_ids": {
      "type": "array",
      "items": { "type": "string" },
      "description": "When the operation reads from multiple parent sets (e.g. concordance_intersect over two callsets). When set, parent_set_id should be omitted (or set to the primary parent)."
    },
    "operation_params_id": {
      "type": ["string", "null"],
      "description": "FK into operation_params_v1.operation_params_id. The bundle of parameter values used (distance_bp, sort_key, choice_rule, seed, …). Null when the operation has no parameters."
    },
    "filter_profile_id": {
      "type": ["string", "null"],
      "description": "Optional FK into a filter-profile registry (e.g. 'popstruct_angsd_sites_v1', 'maf005_callable09_v1'). Captures pre-derivation site/sample filtering. Free-form id string until a formal filter_profile_v1 schema is added; the inventory page treats it as a labelled chip."
    },
    "coordinate_system": {
      "type": ["string", "null"],
      "description": "Genome assembly id when the operation is coordinate-aware (most variant_site / window / interval / breakpoint / gene operations are). Null for entity types without coordinates (sample / bam / chromosome)."
    },
    "analysis_purpose": {
      "type": "string",
      "description": "Why this derivation exists. Free-form short tag (e.g. 'global population structure', 'local PCA inversion scan', 'ngsRelate kinship QC'). Distinguishes two derivations with the same operation+params from one another when they were created for different downstream analyses."
    },
    "software": {
      "type": ["string", "null"],
      "description": "Software / tool that performed the derivation (e.g. 'plink2', 'bcftools', 'angsd', 'custom-thin.py'). Informational; the actual binary path / version go in software_version + software_repo."
    },
    "software_version": {
      "type": ["string", "null"],
      "description": "Specific build / commit / version string."
    },
    "software_repo": {
      "type": ["string", "null"],
      "description": "Optional path or URL to the software source."
    },
    "produces_set_id": {
      "type": ["string", "null"],
      "description": "Optional FK into set_v1.set_id — the primary child set this derivation produced (filled when the child set is registered). Lets set lookups go both directions."
    },
    "output_hash": {
      "type": ["string", "null"],
      "pattern": "^sha256:[a-f0-9]{64}$",
      "description": "sha256 of the canonical produced-set member representation (sorted ids, '\\n'-joined). Matches set_v1.hash on the produced set. Two derivations with the same parent_set + operation_type + operation_params + filter_profile + coordinate_system MUST converge to the same output_hash (and therefore should reuse the same derivation_id)."
    },
    "created_at":      { "type": "string", "format": "date-time" },
    "created_by":      { "type": "string" },
    "status":          { "type": "string", "enum": ["active", "experimental", "deprecated", "stale"], "default": "active" },
    "notes":           { "type": "string" }
  },
  "_examples": [
    {
      "_description": "BEAGLE-input thinning to 1 site per 500 bp, deterministic, for global popstructure analyses.",
      "derivation_id":       "derive_beagle_thin500_global_v1",
      "label":               "BEAGLE thinning — first valid site per 500 bp, per chromosome",
      "operation_type":      "thin_by_distance",
      "parent_set_id":       "snps_maf005_v1",
      "operation_params_id": "thin500_first_per_chrom_v1",
      "filter_profile_id":   "popstruct_angsd_sites_v1",
      "coordinate_system":   "fClaHyb_Gar_LG_v1",
      "analysis_purpose":    "BEAGLE input for ngsRelate / NGSadmix / PCA",
      "software":            "custom-thin.py",
      "software_version":    "v1.0.0",
      "produces_set_id":     "sites_beagle_thin500_global_v1",
      "output_hash":         "sha256:8a7c9d5e4b2f1a3c6e0d9b8a7c5d4e3f2a1b0c9d8e7f6a5b4c3d2e1f0a9b8c7d",
      "created_at":          "2026-04-08T11:42:00Z",
      "status":              "active"
    },
    {
      "_description": "Local-PCA window extraction on LG28 for lostruct.",
      "derivation_id":       "derive_lostruct_LG28_v1",
      "operation_type":      "window_extract",
      "parent_set_id":       "snps_maf005_v1",
      "operation_params_id": "lostruct_LG28_params_v1",
      "filter_profile_id":   "lostruct_site_filter_v1",
      "coordinate_system":   "fClaHyb_Gar_LG_v1",
      "analysis_purpose":    "local PCA inversion scan",
      "software":            "lostruct",
      "software_version":    "v0.0.0.9000",
      "produces_set_id":     "sites_lostruct_LG28_v1",
      "created_at":          "2026-04-10T12:00:00Z",
      "status":              "active"
    }
  ]
}
